{
  "$schema": "sob-dataset-v1",
  "id": "investment",
  "pillar": "growth",
  "topic": "investment",
  "generated": "2026-03-06",
  "sources": [
    {
      "id": "ons-business-investment-q4-2024-revised-",
      "name": "ONS Business Investment, Q4 2024 revised results",
      "url": "https://www.ons.gov.uk/economy/grossdomesticproductgdp/datasets/businessinvestment",
      "note": "GFCF and Business Investment, current prices and chained volume measure, seasonally adjusted."
    },
    {
      "id": "oecd-national-accounts-gross-fixed-capit",
      "name": "OECD National Accounts — Gross Fixed Capital Formation as % of GDP",
      "url": "https://data-explorer.oecd.org/",
      "note": "Dataflow DSD_NAAG@DF_NAAG_III, measure P51G, unit PT_B1GQ. Fetched via OECD SDMX REST API."
    }
  ],
  "series": {
    "ukTrend": {
      "sourceId": "ons-business-investment-q4-2024-revised-",
      "timeField": "year",
      "data": [
        {
          "year": 1948,
          "gfcfCP": 1054,
          "gfcfCVM": 30424
        },
        {
          "year": 1949,
          "gfcfCP": 1237,
          "gfcfCVM": 34517
        },
        {
          "year": 1950,
          "gfcfCP": 1389,
          "gfcfCVM": 37575
        },
        {
          "year": 1951,
          "gfcfCP": 1667,
          "gfcfCVM": 40149
        },
        {
          "year": 1952,
          "gfcfCP": 1896,
          "gfcfCVM": 44587
        },
        {
          "year": 1953,
          "gfcfCP": 2154,
          "gfcfCVM": 55968
        },
        {
          "year": 1954,
          "gfcfCP": 2282,
          "gfcfCVM": 62048
        },
        {
          "year": 1955,
          "gfcfCP": 2744,
          "gfcfCVM": 67163
        },
        {
          "year": 1956,
          "gfcfCP": 3165,
          "gfcfCVM": 72675
        },
        {
          "year": 1957,
          "gfcfCP": 3511,
          "gfcfCVM": 76627
        },
        {
          "year": 1958,
          "gfcfCP": 3780,
          "gfcfCVM": 81431
        },
        {
          "year": 1959,
          "gfcfCP": 3921,
          "gfcfCVM": 87920
        },
        {
          "year": 1960,
          "gfcfCP": 4522,
          "gfcfCVM": 102066
        },
        {
          "year": 1961,
          "gfcfCP": 5096,
          "gfcfCVM": 110335
        },
        {
          "year": 1962,
          "gfcfCP": 5236,
          "gfcfCVM": 111354
        },
        {
          "year": 1963,
          "gfcfCP": 5636,
          "gfcfCVM": 113957
        },
        {
          "year": 1964,
          "gfcfCP": 6652,
          "gfcfCVM": 132408
        },
        {
          "year": 1965,
          "gfcfCP": 7205,
          "gfcfCVM": 138623
        },
        {
          "year": 1966,
          "gfcfCP": 7696,
          "gfcfCVM": 138331
        },
        {
          "year": 1967,
          "gfcfCP": 8346,
          "gfcfCVM": 150409
        },
        {
          "year": 1968,
          "gfcfCP": 9559,
          "gfcfCVM": 166901
        },
        {
          "year": 1969,
          "gfcfCP": 10188,
          "gfcfCVM": 165429
        },
        {
          "year": 1970,
          "gfcfCP": 12339,
          "gfcfCVM": 171880
        },
        {
          "year": 1971,
          "gfcfCP": 13875,
          "gfcfCVM": 184383
        },
        {
          "year": 1972,
          "gfcfCP": 15505,
          "gfcfCVM": 193316
        },
        {
          "year": 1973,
          "gfcfCP": 18727,
          "gfcfCVM": 197099
        },
        {
          "year": 1974,
          "gfcfCP": 21203,
          "gfcfCVM": 182389
        },
        {
          "year": 1975,
          "gfcfCP": 23715,
          "gfcfCVM": 171485
        },
        {
          "year": 1976,
          "gfcfCP": 27184,
          "gfcfCVM": 172649
        },
        {
          "year": 1977,
          "gfcfCP": 31006,
          "gfcfCVM": 175324
        },
        {
          "year": 1978,
          "gfcfCP": 37204,
          "gfcfCVM": 188242
        },
        {
          "year": 1979,
          "gfcfCP": 46189,
          "gfcfCVM": 204441
        },
        {
          "year": 1980,
          "gfcfCP": 52262,
          "gfcfCVM": 191286
        },
        {
          "year": 1981,
          "gfcfCP": 54787,
          "gfcfCVM": 179837
        },
        {
          "year": 1982,
          "gfcfCP": 60122,
          "gfcfCVM": 189191
        },
        {
          "year": 1983,
          "gfcfCP": 66260,
          "gfcfCVM": 203032
        },
        {
          "year": 1984,
          "gfcfCP": 75240,
          "gfcfCVM": 216248
        },
        {
          "year": 1985,
          "gfcfCP": 83468,
          "gfcfCVM": 220729
        },
        {
          "year": 1986,
          "gfcfCP": 89661,
          "gfcfCVM": 218099
        },
        {
          "year": 1987,
          "gfcfCP": 106277,
          "gfcfCVM": 245347,
          "govCP": 13451
        },
        {
          "year": 1988,
          "gfcfCP": 128701,
          "gfcfCVM": 283574,
          "govCP": 12768
        },
        {
          "year": 1989,
          "gfcfCP": 151520,
          "gfcfCVM": 297638,
          "govCP": 17355
        },
        {
          "year": 1990,
          "gfcfCP": 159489,
          "gfcfCVM": 290173,
          "govCP": 21171
        },
        {
          "year": 1991,
          "gfcfCP": 150982,
          "gfcfCVM": 267291,
          "govCP": 20256
        },
        {
          "year": 1992,
          "gfcfCP": 144633,
          "gfcfCVM": 263149,
          "govCP": 18200
        },
        {
          "year": 1993,
          "gfcfCP": 146314,
          "gfcfCVM": 265333,
          "govCP": 17662
        },
        {
          "year": 1994,
          "gfcfCP": 150996,
          "gfcfCVM": 269849,
          "govCP": 18908
        },
        {
          "year": 1995,
          "gfcfCP": 156657,
          "gfcfCVM": 268699,
          "govCP": 17974
        },
        {
          "year": 1996,
          "gfcfCP": 172336,
          "gfcfCVM": 281435,
          "govCP": 16051
        },
        {
          "year": 1997,
          "gfcfCP": 168190,
          "gfcfCVM": 279982,
          "biCP": 115011,
          "biCVM": 158441,
          "biSharePct": 68.4,
          "govCP": 17107
        },
        {
          "year": 1998,
          "gfcfCP": 180027,
          "gfcfCVM": 297889,
          "biCP": 123239,
          "biCVM": 168984,
          "biSharePct": 68.5,
          "govCP": 18632
        },
        {
          "year": 1999,
          "gfcfCP": 187455,
          "gfcfCVM": 302301,
          "biCP": 127108,
          "biCVM": 171791,
          "biSharePct": 67.8,
          "govCP": 18503
        },
        {
          "year": 2000,
          "gfcfCP": 201363,
          "gfcfCVM": 320283,
          "biCP": 135038,
          "biCVM": 182022,
          "biSharePct": 67.1,
          "govCP": 18907
        },
        {
          "year": 2001,
          "gfcfCP": 208326,
          "gfcfCVM": 329123,
          "biCP": 136473,
          "biCVM": 183036,
          "biSharePct": 65.5,
          "govCP": 22913
        },
        {
          "year": 2002,
          "gfcfCP": 216540,
          "gfcfCVM": 333488,
          "biCP": 135224,
          "biCVM": 179891,
          "biSharePct": 62.4,
          "govCP": 25511
        },
        {
          "year": 2003,
          "gfcfCP": 225552,
          "gfcfCVM": 341453,
          "biCP": 135363,
          "biCVM": 178942,
          "biSharePct": 60,
          "govCP": 27939
        },
        {
          "year": 2004,
          "gfcfCP": 236215,
          "gfcfCVM": 350398,
          "biCP": 130216,
          "biCVM": 170702,
          "biSharePct": 55.1,
          "govCP": 34032
        },
        {
          "year": 2005,
          "gfcfCP": 254410,
          "gfcfCVM": 377403,
          "biCP": 154125,
          "biCVM": 209608,
          "biSharePct": 60.6,
          "govCP": 21480
        },
        {
          "year": 2006,
          "gfcfCP": 271298,
          "gfcfCVM": 386050,
          "biCP": 149193,
          "biCVM": 202668,
          "biSharePct": 55,
          "govCP": 37617
        },
        {
          "year": 2007,
          "gfcfCP": 292032,
          "gfcfCVM": 407633,
          "biCP": 163115,
          "biCVM": 219142,
          "biSharePct": 55.9,
          "govCP": 39678
        },
        {
          "year": 2008,
          "gfcfCP": 295010,
          "gfcfCVM": 399172,
          "biCP": 165579,
          "biCVM": 216583,
          "biSharePct": 56.1,
          "govCP": 48098
        },
        {
          "year": 2009,
          "gfcfCP": 264925,
          "gfcfCVM": 352849,
          "biCP": 145145,
          "biCVM": 186202,
          "biSharePct": 54.8,
          "govCP": 51960
        },
        {
          "year": 2010,
          "gfcfCP": 268113,
          "gfcfCVM": 361216,
          "biCP": 147451,
          "biCVM": 191078,
          "biSharePct": 55,
          "govCP": 51306
        },
        {
          "year": 2011,
          "gfcfCP": 270216,
          "gfcfCVM": 360603,
          "biCP": 155262,
          "biCVM": 199419,
          "biSharePct": 57.5,
          "govCP": 47833
        },
        {
          "year": 2012,
          "gfcfCP": 280159,
          "gfcfCVM": 367983,
          "biCP": 166528,
          "biCVM": 211730,
          "biSharePct": 59.4,
          "govCP": 45520
        },
        {
          "year": 2013,
          "gfcfCP": 296889,
          "gfcfCVM": 383415,
          "biCP": 176452,
          "biCVM": 221254,
          "biSharePct": 59.4,
          "govCP": 43729
        },
        {
          "year": 2014,
          "gfcfCP": 322100,
          "gfcfCVM": 411507,
          "biCP": 187871,
          "biCVM": 235726,
          "biSharePct": 58.3,
          "govCP": 50207
        },
        {
          "year": 2015,
          "gfcfCP": 346078,
          "gfcfCVM": 439379,
          "biCP": 205014,
          "biCVM": 256423,